{
  "$schema": "https://json-schema.org/draft/2020-12/schema",
  "$id": "https://contracts.loan-platform.example/schemas/events/credit-application-submitted.v1.schema.json",
  "title": "CreditApplicationSubmitted.v1",
  "type": "object",
  "additionalProperties": false,
  "properties": {
    "eventId": {
      "type": "string",
      "minLength": 1
    },
    "eventType": {
      "const": "CreditApplicationSubmitted.v1"
    },
    "eventVersion": {
      "const": 1
    },
    "occurredAt": {
      "type": "string",
      "format": "date-time",
      "pattern": "^\\d{4}-\\d{2}-\\d{2}T\\d{2}:\\d{2}:\\d{2}(?:\\.\\d+)?Z$"
    },
    "aggregateId": {
      "type": "string",
      "minLength": 1
    },
    "correlationId": {
      "type": "string",
      "minLength": 1
    },
    "causationId": {
      "type": "string",
      "minLength": 1
    },
    "producer": {
      "const": "ApplicationProcess"
    },
    "traceId": {
      "type": "string",
      "minLength": 1
    },
    "payload": {
      "type": "object",
      "additionalProperties": false,
      "properties": {
        "applicationId": {
          "type": "string",
          "minLength": 1
        },
        "customerId": {
          "type": "string",
          "minLength": 1
        },
        "productId": {
          "type": "string",
          "minLength": 1
        },
        "consentReferenceIds": {
          "type": "array",
          "minItems": 1,
          "uniqueItems": true,
          "items": {
            "type": "string",
            "minLength": 1
          }
        },
        "submittedAt": {
          "type": "string",
          "format": "date-time",
          "pattern": "^\\d{4}-\\d{2}-\\d{2}T\\d{2}:\\d{2}:\\d{2}(?:\\.\\d+)?Z$"
        }
      },
      "required": [
        "applicationId",
        "customerId",
        "productId",
        "consentReferenceIds",
        "submittedAt"
      ]
    }
  },
  "required": [
    "eventId",
    "eventType",
    "eventVersion",
    "occurredAt",
    "aggregateId",
    "correlationId",
    "causationId",
    "producer",
    "traceId",
    "payload"
  ]
}
